{
  "episode_id": "EP002",
  "title": "카운트다운",
  "prompt_version": "v3-4step",
  "source_reference": "삼체 원작: 왕먀오 도입, 과학자 연쇄 사망 수사, 카운트다운, 삼체 게임 초대장",
  "scenes": [
    {
      "scene_number": 1,
      "description": "암실에서 현상한 사진에만 카운트다운 숫자가 나타난다. 같은 장소의 디지털 파일에는 숫자가 없고, 왕먀오의 안구 표면에만 같은 숫자가 비친다.",
      "dialogue": []
    },
    {
      "scene_number": 2,
      "description": "나노소재 연구실에서 왕먀오의 정밀한 일상이 제시된다. 동료의 농담과 왕먀오의 대답으로 관찰 방식이 결과를 바꾼다는 테마가 제시된다.",
      "dialogue": [
        {
          "character": "연구원",
          "line": "교수님은 현미경으로 보시면 커피 찌꺼기에서도 논문 찾으실 것 같아요."
        },
        {
          "character": "왕먀오",
          "line": "보는 방식이 틀리면, 결과도 틀리지."
        }
      ]
    },
    {
      "scene_number": 3,
      "description": "스치친이 연구실에 무단으로 들어와 과학자 연쇄 사망과 과학의 경계 초대장 사본을 왕먀오에게 보여준다.",
      "dialogue": [
        {
          "character": "스치친",
          "line": "왕먀오 교수님? 과학자들은 다 이렇게 문을 어렵게 만들어놔?"
        },
        {
          "character": "왕먀오",
          "line": "예약 없는 면담은 받지 않습니다."
        },
        {
          "character": "스치친",
          "line": "그 사람들도 다 바빴어. 죽기 전까지."
        }
      ]
    },
    {
      "scene_number": 4,
      "description": "스치친은 죽은 과학자들이 연구를 멈췄다는 공통점을 말한다. 왕먀오는 우연이라며 방어하지만 가족 그림을 무의식적으로 가린다.",
      "dialogue": [
        {
          "character": "스치친",
          "line": "셋 다 죽기 전에 연구를 멈췄어."
        },
        {
          "character": "왕먀오",
          "line": "그건 통계가 아닙니다. 우연이죠."
        },
        {
          "character": "스치친",
          "line": "우연이 세 번이면 사건이고, 네 번이면 다음 차례를 기다리는 거야."
        }
      ]
    },
    {
      "scene_number": 5,
      "description": "왕먀오의 시야에 첫 카운트다운이 나타난다. 안경, 거울, 행인을 통해 확인하지만 숫자는 왕먀오에게만 보인다.",
      "dialogue": [
        {
          "character": "왕먀오",
          "line": "렌즈 문제야."
        },
        {
          "character": "행인",
          "line": "괜찮으세요?"
        }
      ]
    },
    {
      "scene_number": 6,
      "description": "왕먀오는 눈, 카메라, 모니터, 실험 데이터를 검증하지만 모든 장비는 정상이고 숫자만 계속 줄어든다.",
      "dialogue": [
        {
          "character": "의사",
          "line": "눈에는 이상이 없습니다."
        },
        {
          "character": "왕먀오",
          "line": "정상일 리가 없어."
        }
      ]
    },
    {
      "scene_number": 7,
      "description": "저녁 식탁에서 쯔쯔가 왕먀오에게 말을 걸고 가족 그림을 보여준다. 왕먀오는 정상인 척하지만 불안하다.",
      "dialogue": [
        {
          "character": "쯔쯔",
          "line": "아빠, 오늘도 별 보는 사람 잡으러 갔어?"
        },
        {
          "character": "왕먀오",
          "line": "아빠는 별 말고 아주 작은 걸 봐."
        },
        {
          "character": "쯔쯔",
          "line": "그럼 이것도 작게 보면 비밀 있어?"
        }
      ]
    },
    {
      "scene_number": 8,
      "description": "가족 그림 위에 카운트다운이 겹친다. 왕먀오는 그림을 뒤집어 공포를 숨긴다.",
      "dialogue": [
        {
          "character": "쯔쯔",
          "line": "아빠, 안 보여?"
        },
        {
          "character": "왕먀오",
          "line": "아니. 너무 잘 보여."
        }
      ]
    },
    {
      "scene_number": 9,
      "description": "암실 침묵 페이지. 현상한 모든 사진에 숫자가 나타나고, 마지막 가족 사진 위의 숫자가 가장 선명하다.",
      "dialogue": []
    },
    {
      "scene_number": 10,
      "description": "왕먀오가 새벽 포장마차에서 스치친을 찾아간다. 스치친은 숫자를 공포가 아니라 남은 시간으로 보라고 말한다.",
      "dialogue": [
        {
          "character": "왕먀오",
          "line": "당신들이 뭘 숨기는지 말해요."
        },
        {
          "character": "스치친",
          "line": "숫자가 줄어들지? 그럼 좋은 거야. 아직 남았다는 뜻이니까."
        },
        {
          "character": "왕먀오",
          "line": "그게 위로입니까?"
        },
        {
          "character": "스치친",
          "line": "도망치지 마. 끝까지 봐. 죽은 사람들은 다 중간에 고개를 돌렸어."
        }
      ]
    },
    {
      "scene_number": 11,
      "description": "왕먀오가 연구를 재개하자 숫자가 빨라지고, 제목 없는 메시지로 나노소재 연구 중단 요구가 도착한다.",
      "dialogue": [
        {
          "character": "모니터 텍스트",
          "line": "나노소재 연구를 중지하십시오."
        },
        {
          "character": "왕먀오",
          "line": "누가 장난을 치는 거야."
        }
      ]
    },
    {
      "scene_number": 12,
      "description": "왕먀오는 실험을 시작하고 멈추며 카운트다운 변화 조건을 기록한다. 연구를 계속하면 숫자가 빨라지는 규칙을 발견한다.",
      "dialogue": [
        {
          "character": "왕먀오",
          "line": "조건이 있어요. 연구를 계속하면 빨라집니다."
        }
      ]
    },
    {
      "scene_number": 13,
      "description": "스치친은 상대가 장난을 치는 것이 아니라고 말한다. 왕먀오는 가족 그림과 노트를 나란히 놓고 끝까지 보기로 선택한다.",
      "dialogue": [
        {
          "character": "스치친",
          "line": "장난치고 싶었으면 더 싸게 했겠지. 사람 죽이는 건 비싸."
        },
        {
          "character": "왕먀오",
          "line": "끝까지 보겠습니다."
        }
      ]
    },
    {
      "scene_number": 14,
      "description": "왕먀오는 밤의 연구실로 돌아가 실험 장비를 켜지 않은 채 자신의 눈을 녹화한다. 숫자가 갑자기 멈춘다.",
      "dialogue": [
        {
          "character": "왕먀오",
          "line": "기록 시작."
        }
      ]
    },
    {
      "scene_number": 15,
      "description": "꺼져 있던 메인 모니터가 켜지고 '관찰을 계속하시겠습니까?'라는 문장이 나타난다. 왕먀오는 선택지 앞에서 멈춘다.",
      "dialogue": [
        {
          "character": "모니터 텍스트",
          "line": "관찰을 계속하시겠습니까?"
        },
        {
          "character": "왕먀오",
          "line": "누구냐."
        }
      ]
    },
    {
      "scene_number": 16,
      "description": "모니터 화면에 멈춘 카운트다운과 함께 'Three Body — 게임을 시작하시겠습니까?'라는 초대장이 나타난다.",
      "dialogue": [
        {
          "character": "모니터 텍스트",
          "line": "Three Body — 게임을 시작하시겠습니까?"
        }
      ]
    }
  ]
}
