{
  "episode_id": "EP004",
  "title": "문명의 역사",
  "prompt_version": "v4-continuity",
  "scenes": [
    {
      "scene_number": 1,
      "description": "삼체 게임 내부. 폐허. EP003의 세 태양은 사라지고, 하늘은 불길한 잿빛-보라색. 그림자가 없는 확산광. 구조물 잔해 — 거대한 뼈 같은 것, 녹아내린 금속, 결정화된 유리. 한가운데 왕먀오가 혼자 서 있다. 바닥의 돌에 정교하게 새겨진 숫자: \"137\". 옆에 더 작은 숫자들: \"136\" … \"135\". 손글씨가 아닌 새김눈. 정교하고 의도적. 왕먀오의 얼굴. 피로 + 혼란. 먼지투성이. 입술이 마르고, 눈이 초점을 잃어가고 있다. 중얼거린다.",
      "dialogue": [
        {
          "character": "",
          "line": "이게… 몇 번째야."
        }
      ]
    },
    {
      "scene_number": 2,
      "description": "소패널 1: 황량한 땅에 첫 건물이 세워진다. 깃발이 꽂힘. 작은 인물들이 움직인다. 소패널 2: 도시 완성. 관측탑, 학자들. 하늘에 태양 하나 — 안정. 소패널 3: 하늘에 태양 둘. 과학자들이 패닉. 그림자가 두 방향으로. 소패널 4: 세 태양. 폭염. 건물이 녹는다. 사람들이 도망치나 어디로도 갈 수 없다. 왕먀오가 서 있다. 발밑에 돌탑이 쌓여 있다 — 각 돌에 번호: 138, 139, 140, 141… 돌탑 = 문명의 묘비.",
      "dialogue": [
        {
          "character": "",
          "line": "반복하고 있다. 문명이 생기고… 무너지고."
        }
      ]
    },
    {
      "scene_number": 3,
      "description": "더 빠른 반복 — 소패널 촘촘함. 문명 번호가 빠르게 올라감: 150, 155, 160… 각 소패널에 같은 패턴(탄생→번영→멸망)이 압축. 왕먀오의 얼굴 클로즈업. 피로. 눈이 반쯤 감겨 있음. 입술이 마름. 왕먀오가 유적을 걷고 있다. 돌에 새겨진 숫자들: 162, 165, 167… 그리고 — 한 인물이 앉아 돌에 새김작업을 하고 있다. NPC 기록자. 기록자의 얼굴. 무표정에 가까우나, 눈에 미세한 빛이 있음 — 감정이 아예 없는 건 아니다. 새김도구로 돌에 정교하게 숫자를 새기는 중.",
      "dialogue": [
        {
          "character": "",
          "line": "160번째. 아직도… 계속되고 있다."
        },
        {
          "character": "",
          "line": "당신은… 누구입니까?"
        },
        {
          "character": "",
          "line": "기록자입니다."
        }
      ]
    },
    {
      "scene_number": 4,
      "description": "기록자가 새기던 돌을 들어 올린다. \"167\"이 새겨져 있다. 옆에 쌓인 돌들: 166, 165, 164… 돌탑이 보인다. 기록자가 왕먀오를 올려다본다. 처음으로 눈이 마주친다. 무표정이나, 그 무표정이 오히려 압박적. 왕먀오의 표정 — 대답하지 못한다. 입술이 떨린다. 돌탑의 그림자가 그에게 드리워진다. 기록자가 새김도구를 내려놓는다. 왕먀오를 본다. 그리고 다시 돌을 새기기 시작한다. 한마디만.",
      "dialogue": [
        {
          "character": "",
          "line": "당신은 몇 번째를 목격하고 있습니까?"
        },
        {
          "character": "",
          "line": "저는… 게임을 하고 있는 겁니다."
        },
        {
          "character": "",
          "line": "게임."
        }
      ]
    },
    {
      "scene_number": 5,
      "description": "184번째 문명. 안정기. 도시가 번성한다. 관측탑, 건축물, 시장. 태양 하나. 하늘은 맑은 청록색. Pope in the Pool: 배경에서 시민들의 대화. 왕먀오가 지나가는 동안 시민들이 대화한다. 시민 A가 하늘을 가리키며. 왕먀오가 관측탑에 올라간다. 태양을 본다. 하나. 안정적. 표정이 변하고 있다 — 처음으로 희망 비슷한 것.",
      "dialogue": [
        {
          "character": "",
          "line": "이번엔… 다른 건가."
        },
        {
          "character": "",
          "line": "태양은 하나다. 항상 그래왔다."
        },
        {
          "character": "",
          "line": "관측 기록에 따르면 궤도는 안정적이야. 이번엔 끝나지 않아."
        },
        {
          "character": "",
          "line": "…이번엔 살아남을 수도 있어."
        }
      ]
    },
    {
      "scene_number": 6,
      "description": "관측탑에 서 있던 왕먀오. 하늘에 두 번째 태양이 떠오른다. 시민들이 하늘을 가리키며 소리친다. 그림자가 두 방향으로. 세 번째 태양. 하늘이 붉게 타오른다. 온도가 급격히 오르는 것을 시각화 — 공기가 일렁임. 시민들이 도망친다. 관측탑의 학자가 기계를 확인 — 손이 떨린다. 경보음이 미친 듯이. 왕먀오의 얼굴. 동공이 확장. 이것이 처음이 아님을 안다.",
      "dialogue": [
        {
          "character": "",
          "line": "삐—"
        },
        {
          "character": "",
          "line": "아니…"
        },
        {
          "character": "",
          "line": "예측이… 안 됩니다!"
        }
      ]
    },
    {
      "scene_number": 7,
      "description": "풀 페이지. 세 태양이 하늘을 뒤덮는다. 지면이 갈라지고, 건물이 녹아내리고, 사람들이 도망치지만 그림자가 없다 — 모든 방향에서 빛이 오기 때문. 왕먀오가 한가운데 서 있다. 움직이지 못한다. 주변의 사람들이 쓰러지고 구조물이 붕괴하지만, 왕먀오는 관찰자로서 물리적 영향을 받지 않는다 — 그것이 더 끔찍하다.",
      "dialogue": [
        {
          "character": "",
          "line": "184번째. 기후 재앙: 열 폭풍."
        }
      ]
    },
    {
      "scene_number": 8,
      "description": "풀 스프레드. 아무것도 없다. 폐허. 잿빛 하늘. 바람. 화면의 3분의 2가 하늘(여백). 왕먀오는 페이지 하단에 극히 작게 — 점처럼 서 있다. 주변에 184번째 문명이 있었던 흔적 — 녹아내린 금속, 유리 조각, 재. 발밑에 돌 하나. \"184\"가 새겨져 있다.",
      "dialogue": []
    },
    {
      "scene_number": 9,
      "description": "또다시 문명이 시작된다. 191번째. 건물이 올라가고 도시가 형성된다. 왕먀오의 얼굴. 피로선이 추가됨 — 눈 밑 그림자, 입술의 갈라짐. 무기력. 서서 지켜볼 뿐. 움직이지 않는다.",
      "dialogue": [
        {
          "character": "",
          "line": "또. …또 시작됐다."
        }
      ]
    },
    {
      "scene_number": 10,
      "description": "왕먀오가 기록자를 다시 만난다. 기록자는 돌을 새기고 있다. \"191\"의 숫자. 기록자 옆에 쌓인 돌탑이 엄청나게 높다 — 191개의 돌. 왕먀오의 키를 넘는다. 기록자의 새김도구가 멈춘다. 천천히 왕먀오를 본다. 이번에는 눈에 무언가가 있다 — 무감정이 아니다. 미세한 동요. 왕먀오가 입을 다문다. 대답할 수 없다. 돌탑의 그림자가 둘을 덮는다.",
      "dialogue": [
        {
          "character": "",
          "line": "당신은… 몇 번이나 이걸 했습니까?"
        },
        {
          "character": "",
          "line": "제가 기억하는 한. 전부."
        },
        {
          "character": "",
          "line": "힘들지 않습니까?"
        },
        {
          "character": "",
          "line": "…이번에는 다를까요?"
        }
      ]
    },
    {
      "scene_number": 11,
      "description": "192번째 문명. 가장 발전했다. 데탕트라이트 건축, 정교한 관측 시스템. 왕먀오가 도시를 걷고 있다. 감탄이 아니라 불안. 하늘이 변한다. 빠르다 — 184번째보다 훨씬 빠르다. 태양이 둘, 셋. Pope in the Pool: 왕먀오가 녹아내리는 도서관을 지난다. 책이 타들어간다. 한 페이지가 날려서 왕먀오 발 앞에 떨어진다 — \"궤도 예측 불가능\" 수식. 도시가 무너진다. 발전한 기술이 무용하다 — 자연법칙 앞에서. 왕먀오가 얼어붙어 지켜본다.",
      "dialogue": [
        {
          "character": "",
          "line": "이 정도면… 살아남을 수도."
        },
        {
          "character": "",
          "line": "삐—"
        }
      ]
    },
    {
      "scene_number": 12,
      "description": "멸망 후. 잿빛. 기록자가 마지막 돌을 새기고 있다. \"192\". 새김도구의 소리가 페이지에 선으로 표현됨. 기록자가 돌을 들어 올린다. 탑 위에 올려놓는다 — 탑이 무서울 정도로 높다. 192개의 돌. 기록자가 왕먀오를 돌아본다. 이번에는 눈에 확실히 무언가가 있다 — 무감정이 아니다. 입꼬리가 미세하게 떨림. 왕먀오의 얼굴. 대답하지 못한다. 입이 열려 있으나 소리가 없다. 눈에 192개의 돌탑이 비친다.",
      "dialogue": [
        {
          "character": "",
          "line": "뚜. 뚝. 뚜."
        },
        {
          "character": "",
          "line": "192번째 기록. 완료."
        },
        {
          "character": "",
          "line": "당신은 왜 계속 보고 있습니까?"
        }
      ]
    },
    {
      "scene_number": 13,
      "description": "풀 스프레드. 모래만 있다. 하늘은 희미한 회색. 지면은 모래. 중앙에 돌 하나. \"192\"가 새겨져 있다. 바람이 분다. 모래가 돌 위로 흩날린다. \"192\"의 숫자가 서서히 지워진다. 왕먀오는 아주 작게, 페이지 구석에 서 있다 — 혹은 서 있는지조차 불확실하다.",
      "dialogue": []
    },
    {
      "scene_number": 14,
      "description": "모래 사막. 왕먀오가 서 있다. 갑자기 — 화면 가장자리에 글리치. 게임 HUD(체력 바, 미니맵, 퀘스트 표시)가 보인다. 그것들이 떨린다. HUD 요소들이 하나씩 사라진다. 깜빡이고, 녹아내리고, 부서진다. 미니맵, 체력 바, 퀘스트 텍스트가 연속적으로 붕괴. 게임의 잿빛 하늘에 균열이 생긴다. 균열 너머로 별이 보인다. 진짜 별. 왕먀오가 하늘을 올려다본다. 입이 벌어진다.",
      "dialogue": [
        {
          "character": "",
          "line": "…?"
        },
        {
          "character": "",
          "line": "이건…"
        }
      ]
    },
    {
      "scene_number": 15,
      "description": "풀 페이지. 게임의 잿빛 세계는 완전히 사라졌다. 어둠. 그리고 그 어둠 속에 별 — 진짜 별. 빈 화면에 하나의 메시지만:",
      "dialogue": [
        {
          "character": "",
          "line": "이것은 게임이 아닙니다."
        },
        {
          "character": "",
          "line": "192번의 멸망. 이것은 기록입니다."
        }
      ]
    }
  ]
}
