{"episode_id":"EP001","title":"삼체 게임 — 왕미오의 입장","scenes":[{"scene_number":1,"description":"황혼의 도시 전경. 낡은 아파트 단지.","dialogue":[]},{"scene_number":2,"description":"대학 강당. 붉은 깃발.","dialogue":[{"character":"왕미오","line":"물리학은 진리다. 어떤 정치도 그것을 바꿀 수 없다."},{"character":"홍위병1","line":"그대의 사상은 반동이다!"}]},{"scene_number":3,"description":"비밀 연구실. 컴퓨터 화면에 삼체 게임.","dialogue":[{"character":"왕미오","line":"삼체... 무엇을 의미하지?"}]}],"prompt_version":"v1-dryrun","source_reference":"삼체문제 1권 1장"}
